,company,job_title,job_descr,time_of_scrape,job_search_term,job_location,salary_from_page_source_as_stated,salary_from_page_source_conv_hourly,salary_from_page_source_time_period,Num_reviews,Loc_from_title,date
43,Cubica,"Algorithm & Software Developer (Machine Learning, Computer Vision)",Job Type Tenure Salary Negotiable Experience Ideally 1 year Education Phd Overview No Machine Learning experience We are currently recruiting for an Algorithm Software Developer specialising in Machine Learning and Computer Vision You will be working on state of the art system for processing imagery video sensor and intelligence data Experience in Machine Learning and Computer vision is beneficial but not a strict requirement please see job detail In the first instance please send your CV to with a note Main Responsibilies As an Algorithm Software Developer in our small research and you to building machine learning vision capability You will be working on application of state of the art algorithm to real world problem You will develop new bespoke algorithm adapt and improve existing algorithm and deploy them in high performance software You will be using back-ends like OpenCV Tensorflow Caffe Keras and CTNK and regularly using Deep Learning technology You ll be in our team of scientist mathematician and developer and will be given high level of responsibility from a very early stage All our employee learning about new technology and state-of-the-art algorithm and have creative in planning and executing their work We tailor our role to each individual ensuring that their skill are put to best use and to professional development As well a the technical depth and variety you will experience you will have the chance to work on system and technology that can have a genuine impact on security and society Required Experience An undergraduate degree and PhD in Mathematics Physics Computer Science or Engineering is The role is open to graduate a well a those with experience Whilst experience in Machine Learning and Computer Vision Image Processing is beneficial we are more focussed on talking to candidate who have an excellent mathematical grounding experience of software engineering principle and good practice and a desire to learn and develop their capability Technical Abilities These role require an excellent academic background and skill are vital with Python C or C being beneficial We are particularly interested in applicant who can demonstrate that they have learnt new skill and expertise in their own time on personal project and those who are to the open If you have a real passion for software and would like to be involved in building some truly exciting technology please get in touch Get in Touch Show phone number Unit 4 Woking 8 Forsyth Road Woking Surrey GU21 5SB Show phone number Unit 4 Woking 8 Forsyth Road Woking Surrey GU21 5SB ,Tue Nov 24 14:02:45 2020,"title:(machine, learning)",,,,,,Woking,2020-11-24
44,Seldon,Machine Learning Engineer (Product),Following a year of rapid growth in our open-source ML project and winning top tier customer across sector to support strategic AI platform initiative Seldon is expanding rapidly We are looking for a Machine Learning Engineer to join our Product Engineering function and help u build the future of production machine learning About Seldon Seldon is a London based scale-up that build open source and enterprise machine learning framework that power massive scale deployment of production AI system Our open source framework benefit from over 2 000 000 installation and power our enterprise product Seldon Deploy which is currently being used by some of the leading global organisation across industry such a automotive pharma finance etc About the role Your role at Seldon will primarily involve Building and extending production machine learning system at scale based on our open source and enterprise product Work with our R D and Product team to integrate data science functionality into product feature Contributing to our open source project to extend their functionality Architecting solution and optimising the performance of critical industry machine learning system Identifying documenting best practice for ML Engineering Contributing to global Growing within a scaling startup crafting a role of your own Required skill A degree or higher level academic background in a scientific or engineering subject science foundation Strong understanding of the data science lifecycle Strong System architecture Familiarity with linux based development Experience architecting applying technology to solve real world challenge Experience delivering production-level client-facing project Nice-to-have Experience with Kubernetes and the ecosystem of Cloud Native tool Experience maintaining deploying machine learning model in production Benefits Share option to align you with the long-term success of Access to lunch gym shopping and cinema ticket Healthcare benefit Tier 2 visa support Flexible work-from-home policy Cycle To Work Scheme About our tech stack Some of our high profile technical project We author and maintainer of Seldon Core the most popular Open Source model serving solution in the Cloud Native Kubernetes ecosystem We built and maintain the black box model explainability tool Alibi We of the KFServing project with Microsoft Google IBM etc on extending the project We contributor of the Kubeflow project and meet on several workstreams with Google Microsoft RedHat etc on a weekly basis We are part of the SIG-MLOps Kubernetes open source working group where through example and prototype around ML serving We run the largest Tensorflow meetup in London And much more Some of the technology we use in our day-to-day Go is our primary language for all-things backend infrastructure including our Kubernetes Operator and our new GoLang Microservice Orchestrator Python is our primary language for machine learning and power our most popular Seldon Core Microservices wrapper a well a our Explainability Toolbox Alibi We leverage the Elastic Stack to provide full data provenance on input and output for thousand of model in production cluster Metrics from our using Prometheus with custom Grafana integration for visualisation and monitoring Our primary service mesh backend leverage the Envoy Proxy fully integrated with Istio but also with an option for Ambassador We leverage gRPC protobufs to standardise our schema and reach processing inference graph We use React j for our all our enterprise user product and interface Kubernetes and Docker to and run all of cloud native technology stack Logistics Our interview process is normally a phone interview task and 2-3 hour of final interview carried out virtually We promise not to ask you any brain teaser or trick question We might design a system together on a whiteboard the same way we often work together but we won t make you on one Our recruitment process ha an average length of 3 week ,Tue Nov 24 14:02:50 2020,"title:(machine, learning)",,,,,,London,2020-11-24
45,ShareForce,Product Engagement Lead - Machine Learning and AI,Job Description Product Engagement Leads are people with a specialism in client management product management or delivery Whatever their background they are Product Thinkers obsessed with solving real valuable problem Product Engagement Leads are value-focused and always looking to deliver product and solution which solve real customer problem are creative thinker problem solver and doer are leading engagement with client are passionate about the potential of AI ML to create a positive impact are curious and questioning they identify gap before they issue are obsessed with User Experience and ensuring that product are used and loved by customer love working in multidisciplinary team alongside engineer data scientist and sale and marketing team believe in the benefit of agile incremental delivery to ensure value is being delivered at every step are technically minded and have a good base of understanding of machine learning can articulate a vision for a product they look after and can cut through the noise of requirement and feature request to zone in on what s important They re not afraid to say no have worked in great team before and know how to nurture a culture which delivers real value quickly Responsibilities build and maintain positive client relationship from pre-sales through to delivery and managed service run unique workshop designed to identify qualify and validate AI opportunity ass client opportunity and challenge through interview and data analysis to AI ML proposition lead development activity using agile methodology including owning and prioritising the product backlog develop pricing strategy for our product and service to ensure DataSparQ delivers a robust value proposition produce documentation and marketing material for DataSparQ product and everything from the high level business benefit to the technical detail contribute to product strategy working closely with in the Product Management team Typical Experiences a an engagement lead in a professional responsible for ensuring agreed scope is delivered on time and budget a a product manager responsible for the launch of a new product from identifying the customer need to defining a minimum viable product and going to market a an agile delivery lead scrum master project manager responsible for running day to day delivery for a multidisciplinary team including software engineer and data scientist working in a delivery UX or technical role on a product project which lean heavily on data machine learning or AI Additional Information Salary Basic Salary 70k 85k based on expereince Bonus Excellent Benefits Home Central London Our Client Our client is a well-funded Data and AI Scale-Up using the latest development in big data and machine learning technology to re-imagine decision making for some of the UK s They design build and run Machine Learning and AI product data science and design to solve valuable problem for customer Additionally they develop and maintain a platform and AI engine which form the basis of bespoke AI product These offer value to customer a they allow the delivery of significant benefit quickly and reliably ,Tue Nov 24 14:02:56 2020,"title:(machine, learning)",,85000.0,44.78,Y,,London,2020-11-24
46,Harnham,Machine Learning Lead,MACHINE LEARNING LEAD 600 650 PER DAY 6 MONTHS LONDON REMOTE BASED A chance to shape the Data Science product strategy for a leading THE COMPANY As a Machine Learning Lead you will for a on innovative product You will work in an agile team leading a small group of Data Scientist As a Machine Learning Lead you will be responsible for not only research and development of different Machine Learning focused product but also overall Data Science strategy THE ROLE As a Machine Learning Lead you must be an expert in Python and be very familiar with Machine learning tool such a Numpy Scikit-Learn Scipy As a Machine Learning Lead you must be familiar with random forest decision tree a well a more advanced model building with Neural Networks As a Machine Learning Lead you must also be able to deploy your own model using PySpark Docker Any experience with the cloud specifically AWS is valuable a a Machine Learning Lead As a Machine Learning Lead you must have experience leading small team from a technical perspective and be able to demonstrate your to Data Science product development As a Machine Learning Lead you must have skill and problem solving skill As a Machine Learning Lead you must also be able to work alongside key member of the business and able to demonstrate not only expertise within Data Science but also an understanding on how to drive business solution YOUR SKILLS AND EXPERIENCE The successful Data Scientist will have the following skill and experience Extensive experience with Python Numpy Scikit-Learn Scipy Commercial experience working on different customisation and model Good use of PySpark use of Neural Networks Led small team Demonstrate a to overall data science strategy product development PHD in Computer Science or equivalent The ideal candidate will have worked in AWS Familiarity with Docker Previous experience within Biotech THE BENEFITS day rate of up to 650 per day HOW TO APPLY Please register your interest by sending your CV to Anna Greenhill via the Apply link on this page ,Tue Nov 24 14:03:01 2020,"title:(machine, learning)",,650.0,89.04,D,9.0,London,2020-11-24
47,Touch Surgery,Machine Learning Platform Engineer,5 billion people two-thirds of the world s population do not have access to safe and affordable surgical care As a result million go untreated every year causing unnecessary suffering permanent debilitation or death The cause are a shortage of surgeon varying quality of care of training surgeon lack of funding and lack of accessibility to quality surgery Digital Surgery is on a mission to change surgical care for the better With our award-winning Touch Surgery mobile application and web platform it is now the dawn of Digital Surgery Digital Surgery ha created a digital data-driven ecosystem that us the latest technology like AI augmented reality vision to modernize surgical training orchestrate surgical team in the OR and deliver safer surgery around the world As a Machine Learning Platform Engineer within the Innovation team in Digital Surgery you will help to design implement and test Machine Learning framework and infrastructure to support other engineer and researcher of the team You will part of a talented team exploring through fast iterative prototyping vision machine learning team is responsible for developing solution that allow u to scale our automatic surgical understanding capability from raw video data Here s what you ll do not all of it just the important stuff Creating and maintaining AWS infrastructure for supporting the preparation development and deployment stage of ML model lifecycle Creating pipeline and assisting team member in deploying ML model into production environment Responsible for developing and maintaining our internal machine learning framework a well a assisting other member of the team As optional part of the role you will have the opportunity on ML project and perform task such a object detection localization and tracking segmentation and scene understanding Requirements Requirements Must have Proven experience working with AWS service S3 EC2 ECS Experience using CI pipeline Travis Jenkins BItbucket Experience with automation library Ansible Terraform focused on cloud deployment in machine learning with a good understanding of the process of training and inference with deep learning model Deliver well-written and Excellent in verbal and skill and Experienced in working in a fast-paced R D environment Nice to have Experience with back-end development Flask Django and data visualization experience would also be useful for this role of at least one of the main deep learning framework Pytorch Tensorflow Keras etc Ability to debug technical problem both software package and identifying cause and reasoning optimal next-step solution Benefits We re in a really lucky position to operate like a small team with all of the benefit of a Following our acquisition by Medtronic in February 2020 our benefit have had an impressive face lift Our benefit package aim to help support your health build wealth grow in your career and share in the success of Digital Surgery and Medtronic We are in the healthcare business and so in order to look after our people we provide Private healthcare via AXA PPP 100 excess 30 day holiday 8 bank holiday Pension scheme we double your of up to 6 12 Annual bonus scheme Annual meal allowance Life insurance 4 x annual salary Group Protection 67 of insured salary payable until pensionable age Life benefit policy Maternity 20 week full pay 15 returner s bonus Paternity 2 week full pay Employee Assistance Programme support line legal or financial advice This is not to mention all the other perk for working with u such a our employee program a cash bonus for referring a friend and a whole host of other wellness benefit We also flexible working so you choose when you start and finish This is just one of our Family policy So what s it like working at Digital Surgery Part of the Medtronic family we benefit from a feel within the world s leading medical We have 130 people globally with team across the UK US and Canada The majority are based in our London HQ in Old Street is made up of several Engineering Product Studio Innovation Marketing HR Operations Finance and Sales We care about our employee career and development offering training internally a well a and attending We believe that helping you grow will help grow too We have our Family Meeting on Friday afternoon with beer wine drink it s a great chance to meet new joiner share success story and hear what s been going on in that week Our Values All for One Candid but Kind Equitable Grit Deliver Extraordinary Things Come help u to build that make a difference that change life that save life COVID19 During this global crisis we have erred on the side of caution in our handling We closed the office 3 week before the lockdown in order to protect our employee As flexible working ha always been on the table our preexisting IT infrastructure ha allowed u to seamlessly transition to life in lockdown across the wider organisation Despite the global crisis to grow and are interviewing and onboarding candidate remotely so please do APPLY to express your interest in our vacancy ,Tue Nov 24 14:03:07 2020,"title:(machine, learning)",,,,,3.0,London,2020-11-24
48,Venturi,Machine Learning Engineer,Machine Learning Engineer Data engineering Data Science ML Data engineer Scientist is required for a tech-driven based in a stylish central London location This is a diverse opportunity for a Data Scientist with machine learning and Python engineering experience to join an innovative SAAS who are at the forefront of their industry You will be exploring huge amount of structured and unstructured data implementing your finding and taking responsibility for the entire lifecycle of the product creating a prototype evaluating user testing and engineering in Python What s in it for you a the ML Python Engineer Data Scientist The ML Engineer Data Scientist will have salary of up to 85 000 depending on experience Being part of an award winning ML Being part of a dynamic team and having autonomy in your work Working with a modern tech stack Independent learning budget and great career opportunity Very generous holiday and a supportive working environment Flexible working hour 2 day remote working from home Team lunch and trip Key Skills and Responsibility of the ML Engineer Data Scientist Expert of machine learning and NLP Practical experience in delivering a product end to end creating a prototype evaluating user testing in python A degree in Computer Science Physics Engineering or Mathematics skill Ability to work in an agile environment with a small close-knit team Excellent Python programming skill and machine learning NLP library Excellent critical thinking skill and a hard-working start-up mentality Nice to have but not essential Experience with NoSQL SQL database AWS experience As you can see this is a well-rounded and diverse opportunity to use skill in all area of Data Science ML and engineering to deliver an award-winning product Don t miss out on this opportunity to join an innovative organisation in the machine learning industry a a Data Scientist Python Engineer To apply for this position please send a recent CV to Keywords for search Pandas Machine Learning Python Data Scientist Numpy Scipy Sklearn ML Pandas Machine Learning Python Data Scientist Numpy Scipy Sklearn ML Big Pandas Machine Learning Python Data Scientist Numpy Scipy Sklearn ML Pandas Engineer Machine Learning Python Data Scientist Numpy Scipy Sklearn ML Pandas Engineer Machine Learning Python Data Scientist Numpy Scipy Sklearn ML Venturi TVGL Inc is an equal opportunity employer and doe not discriminate on the basis of sex including pregnancy gender gender identity genetic information marital status military veteran status national origin ancestry race religion sexual orientation transgender status non-disqualifying physical or mental disability domestic violence victim status criminal or arrest unemployment status or any other basis protected by applicable law ,Tue Nov 24 14:03:12 2020,"title:(machine, learning)",,85000.0,44.78,Y,8.0,London,2020-11-24
49,Evi Technologies Limited,"Applied Science Internship - Speech Technologies, Computer Vision, Machine Learning",Experience programming in Java C Python or related language Master s in Computer Science Mathematics Machine Learning or related quantitative field Enrolled in a Master s or Ph D degree in science machine learning operation research statistic or related field Experience in designing experiment and statistical analysis of result Experience in understanding and ability to implement algorithm using both toolkits and self Experience with Java C or other programming language a well a with R MATLAB Python or similar scripting language Are you a MS or PhD student interested in a 2021 Applied Science Internship in the field of Speech Robotics Computer Vision or Machine Learning Deep Learning Do you enjoy diving deep into hard technical problem up with solution that enable successful product that improve the life of people in a meaningful way If this describes join our research team at Amazon As an Applied Science Intern you will have access to large datasets with billion of image and video to build large-scale machine learning system Additionally you will analyze and model terabyte of text image and other type of data to solve real-world problem and translate business and functional requirement into quick prototype or proof We are looking for smart scientist capable of using a variety of domain with machine learning and statistical technique to invent design evangelize and implement state-of-the-art solution for never-before-solved problem Machine Learning Science Amazon ha multiple position available for Machine Learning Scientists in Berlin Cambridge Edinburgh Iasi and Tuebingen A few of the team that are hiring include Core AI Amazon Search AWS AI Advertising Technologies Community Shopping Prime Video Speech and Language Technology We are hiring in all area of spoken language understanding ASR NLP NLU Machine Translation text-to-speech TTS and Dialog Management Amazon ha multiple position available for Speech Scientists in Aachen Barcelona Berlin Cambridge Edinburgh Gdansk Haifa Tel Aviv and Turin A few of the team that are hiring currently include Alexa ML Alexa Domains Alexa Brain Alexa Shopping Amazon Search CS Technology Computer Vision Amazon ha multiple position available for Computer Vision Scientists in location such a Berlin Barcelona Tuebingen Haifa and Tel Aviv We are currently hiring for multiple team including Visual Search Amazon AI AWS Rekognition Amazon Go Lab126 Enrolled in Ph D degree in science machine learning operation research statistic or related field Familiar with undergraduate curriculum science Technical understanding and discussing and algorithm tradeoff and new opportunity with technical team member Publications at top-tier or journal Excellent critical thinking with the ability to present your belief clearly in both verbal and written form Equal Opportunities Amazon is an equal opportunity employer We believe passionately that employing a diverse workforce is central to our success We make recruiting decision based on your experience and skill We value your passion to invent simplify and build EU Student Programs Team ,Tue Nov 24 14:03:18 2020,"title:(machine, learning)",,,,,67007.0,Cambridge,2020-11-24
