,company,job_title,job_descr,time_of_scrape,job_search_term,job_location,salary_from_page_source_as_stated,salary_from_page_source_conv_hourly,salary_from_page_source_time_period,Num_reviews,Loc_from_title,date
143,PGSM Consulting,AI Scientist - Machine Learning,You ll with an engineering team to bring model into toolkits and business developer to impress the client AI Scientists are expected to have strong publication or project showing clear evidence of high-quality research and innovation in field directly related to AI and proven experience and ability to implement high-performance AI solution The responsibility and in particular Analyze data to pattern find opportunity and develop and apply innovative ML algorithm Validate new or improved model via statistically relevant experiment Work closely with AI engineer to build scalable prototype for testing and integrate successful model and algorithm in production system Support in identifying opportunity in creating customer value with AI Advance exploratory research project in Machine Learning and related field to create highly innovative customer experience ,Tue Nov 24 14:11:54 2020,"title:(machine, learning)",,,,,,Reading,2020-11-24
144,GCS Recruitment Specialists Ltd,Remote or Cambridge Based - Data Scientist / Machine Learning,Data Science Machine Learning IOT Warehouse management system Remote or Cambridge Salary dependent on experience The Role To work on a greenfield IOT warehouse management system The Person You will be a problem solver above all else open to using new technology and have an R D mind-set Strong academic help The Requirements MSc or PhD in a quantitative or technical discipline Computer Science Maths Statistics NatSci Engineering or similar Proficiency in Python Understanding of statistical analysis Experience with and ability to use machine learning technique to achieve a useful and verified saving Experience with working on large data set and data preprocessing wrangling Familiarity with SQL database and backend system is a plus Strong organisational and self-starting skill happy to work in a team and the result using data visualisation tool if necessary Desireable Time-series forecasting e g auto-regressive model Probabilistic machine learning e g Gaussian process Discrete event simulation e g SimPy or pure Python Experience with simulation in general even if not discrete event simulation an advantage Discrete optimisation e g genetic algorithm branch programming demonstrating capacity to implement customised algorithm a opposed to using standard off the shelf method The Team The brightest in the industry location not being a factor they have gathered great problem solver mathematician and scientist to work on this greenfield project The Project Large logistics warehouse solution The Location Remote 1 day fortnightly in the Cambridge Office GCS Computer Recruitment Services is acting a an Employment Agency in relation to this vacancy ,Tue Nov 24 14:12:00 2020,"title:(machine, learning)",,65000.0,34.25,Y,2.0,London,2020-11-24
145,STEM Graduates,Machine Learning Engineer,Location London Job Type Graduate Schemes Salary Sector Technology Consulting Project Management Technology IT and Software Engineering Location London Job Type Graduate Schemes Salary Sector Technology Consulting Project Management Technology IT and Software Engineering Kubrick Group is a specialist with a twist We hire a diverse range of junior professional and graduate from across we pay you while we train you in the latest data and business skill and then place you into in a variety of different sector Through our training we will develop you into a highly skilled who can go onto a leading expert in your field We work across all sector and our project have included helping retailer fashion trend car manufacturer project sale of new model and even hospital understand the real reason for the growth in patient number in their A E department If these sort of challenge excite you Kubrick would like to hear from you a we are looking for our next intake of Machine Learning Engineers Kubrick s Machine Learning Engineers assist our client by extracting value from data by integrating deep from multiple discipline such a science and domain to draw meaningful insight improve decision making trend and increase efficiency within an organisation Embark on your exciting and challenging 15-16-week training period in our data lab in London and then get to work for one of our most exciting client in the UK What you ll do be paid to be trained by u from the day you join We fully prepare our people in our London data lab before they go on client site Be taught all the latest technology skill relevant to data challenge such a Python including Numpy Pandas Scikit-Learn and PyTorch SQL Spark Cloud Computing NoSQL and DevOps Learn about the most industry relevant data science technique including machine learning model such a linear regression random forest and deep neural network Apply data science algorithm to solve practical real-world problem Examples case study include price image classification and sentiment analysis Receive soft skill training including office skill networking career management interview practice transitioning to client site etc in addition to Q As with our HQ on client site Kubrick Alumni and Clients Learn from the best in the sector are designed by industry figure head Work a for Kubrick following your training and integrate yourself into data team with the option to join them permanently after your two year on client site Here are some example of the project we have worked on We have built chatbots to enhance customer experience Complex dashboard with AI for banking client so they have greater information at their fingertip Implementation of blockchain within the travel industry making transaction quicker and more secure Created a data analytics database chemistry a part of a wider data infrastructure for augmented drug Sentiment Engines built for retailer to better understand demand Used Machine Learning and modelling to foresee and solve potential customer problem before they happen for a client Improving health treatment and food nutrition for pet using Natural Language Processing on vet note What we need from you Proven analytical and problem solving skill we don t need any skill just excitement to learn Team player you have the desire and share with Desire to work with data to help organisation improve efficiency and decision making Strong interest for analytics data and technology skill both oral and written A strong work ethic to producing high quality solution Flexibility a positive attitude maturity and humility Geographic flexibility you must be able to attend training in London and then be placed either in London or around the UK Minimum degree requirement Educated to degree level with at least A level mathematics or statistic and minimum of 120 new 300 old UCAS point Master s degree with preferably a strong though exceptional candidate with a Bachelor s degree will also ,Tue Nov 24 14:12:05 2020,"title:(machine, learning)",,37500.0,19.76,Y,,London,2020-11-24
146,Jenoptik AG,Machine Learning Intern - 2021,Reference number 2218 Location Camberley Responsibilities The role involves assisting in and dataset management a well a developing in-house automation and analysis tool a part of a research team responsible for all Deep Learning application a well a other area vision To assist in preparation and management of relevant data and image set To modify and extend script and program which automate the above task and visualise the result To assist in the training and evaluation of machine learning algorithm under the supervision of other team member To all change made and document both software and research output To work at all time in with the Health Safety at Work Act 1974 and to follow and guideline which assist this To work at all time in with policy To undertake such other duty a may be required within the general scope of the job Qualified candidate will posse The holder is expected to be a student undertaking a degree in a technical discipline Proficient in general IT skill on both Windows and Linux system Experience with programming or scripting particularly Python is a definite advantage Mathematics or statistical analysis training is beneficial but not essential Interest in the subject is totally vital Further Information A CV letter is required when applying Closing date 03 01 2021 Interviews January 2021 Start date Summer 2021 About Jenoptik At Jenoptik people with the specific JENIUS character are changing the world with the power of light That demand a spirit of exploration and dedication If you re one of meet the challenge facing the world At Jenoptik we re creating a better future for all of u The Light Safety division help governmental and governmental body to make our road and safer For this purpose Jenoptik develops manufacture and system and service towards greater road traffic safety throughout the world The product comprehensive system relating to all aspect of road traffic such a speed measurement and red light monitoring system OEM Original Equipment Manufacturer product and system for the detection of traffic violation Thanks to the of several sensor technology with software and data management Jenoptik is also a new system supplier for truck toll monitoring on federal highway in Germany Work with u to ensure that system and to making road safer Have we made you interested in this position If so we look forward to receiving your online application Should you need any further information please do not hesitate u Holly Bennett ,Tue Nov 24 14:12:11 2020,"title:(machine, learning)",,,,,35.0,Camberley,2020-11-24
147,Argo Recruitment Services Limited,C++ Software Engineer Machine Learning Artificial Intelligence,Intrigued by Machine Learning and Artificial Intelligence Perhaps you are a C Software Engineer looking to break into that field Well if that is the case then here is your chance My client is one of the most in the UK and potentially on the global stage looking to on board some of the most talented C Software Engineers around You will experience of C preferably also working with Python It would be advantageous if you have worked with an understanding of GPU A background in Machine Learning and Artificial Intelligence is not essential all that is required is your C skill There are role available at all level including graduate plus my client is offering superb salary So suit you if you are looking to leave London to have that salary Please send your CV detail so we can have chat about this fantastic opportunity Reference ID MachLearn 108Job Types Full-time PermanentPay 40 000 00 85 000 00 per yearBenefits Casual dressCompany eventsCompany pensionLife insurancePrivate dental insurancePrivate medical insuranceWork from homeExperience C 2 year remotely Yes temporarily due to COVID-19 ,Tue Nov 24 14:12:17 2020,"title:(machine, learning)",,85000.0,44.78,Y,,Bristol,2020-11-24
148,GCS Recruitment Specialists Ltd,Remote Data Scientist / Machine Learning Engineer - Time Series,Time Series IOT Warehouse management system Permanently Remote or Cambridge Salary dependent on experience The Role To work on a greenfield IOT warehouse management system The Person You will be a problem solver above all else open to using new technology and have an R D mind-set Strong academic help The Requirements MSc or PhD in a quantitative or technical discipline Computer Science Maths Statistics NatSci Engineering or similar Proficiency in Python Understanding of statistical analysis Experience with and ability to use machine learning technique to achieve a useful and verified saving Experience with working on large data set and data preprocessing wrangling Familiarity with SQL database and backend system is a plus Strong organisational and self-starting skill happy to work in a team and the result using data visualisation tool if necessary Desirable Time-series forecasting e g auto-regressive model Probabilistic machine learning e g Gaussian process Discrete event simulation e g SimPy or pure Python Experience with simulation in general even if not discrete event simulation an advantage Discrete optimisation e g genetic algorithm branch programming demonstrating capacity to implement customised algorithm a opposed to using standard off the shelf method The Team The brightest in the industry location not being a factor they have gathered great problem solver mathematician and scientist to work on this greenfield project The Project Large logistics warehouse solution The Location Remote GCS Computer Recruitment Services is acting a an Employment Agency in relation to this vacancy ,Tue Nov 24 14:12:22 2020,"title:(machine, learning)",,90000.0,47.42,Y,2.0,London,2020-11-24
149,Amazing Prospects Ltd,Machine Learning Engineer,Within this software house in London sits a hub of innovative R D A stealth team of Machine Learning expert that are busy working on new way of technology They are light year ahead of which turn idea into reality From this small team they have engineered a jaw-dropping Computer Vision solution and this is your opportunity to get involved in furthering the reach and capability To you ll have a research background Comfortable working with An active interest in Machine Learning and algorithm work Object detection Segmentation Bayesian SVM Deep Learning Essential Academic Research ML Python Computer Vision Deep Learning AI This role is going to appeal to an engineer that love the fusion of research and development Intent on developing application that will change the way in which human and machine integrate in the future Expect a starting salary this position also attracts additional financial benefit This is an opportunity to play a vital role with the new development of this technology A unique chance to join the team of expert and application are invited from engineer of all level Office based with some Work From Home Amazing Prospects Ltd We are Technology recruitment for We will share with you the brightest Start-ups Scale-ups and high-growth SME s ,Tue Nov 24 14:12:28 2020,"title:(machine, learning)",,75000.0,39.52,Y,6.0,London,2020-11-24
150,Arm,Staff Software Engineer - Machine Learning,Show more This role present an excellent opportunity to move into Machine Learning ML the key development for the future Working on the groundbreaking Arm technology you will be creating the software that power the next generation of mobile apps portable device home automation smart city self-driving car and much more About the role The Machine Learning group in Arm ha developed a specialised Neural Network Processor NPU to accelerate these workload and datacenter device Located at Arm s Global HQ in Cambridge the NPU software team is releasing quarterly feature update to this processor line Your technical strength and focus on empowering our user will embed this design in million of world-changing device What will I be for As a staff software engineer you are going to the design and implementation of the lower level driver stack ensuring that is integrates well in the ML software stack This includes diverse area such a input network graph processing and transformation low-level hardware programming efficient memory allocation including DMA and MMU programming a well a optimisation across the whole software stack More than anything else you must have a willingness to absorb a much a possible about this new frontier Given the impact and reach of this field you ll be required to share this with other specialist across What technical skill and experience should I have Experience of the software lifecycle having software from feasibility through to production and support Strong programming expertise including very good C skill and of a scripting language such a Python Understanding of how to rigorously test software and design software for test Experience across different development platform possibly having worked with software model and development board Ideally exposure to some of the following low-level programming driver development Linux kernel module of ARM assembly language and or architecture of ML tool and technique are not a learning on the job is possible But if you have dabbled already be sure to let u know What about interpersonal skill Capable of working independently or in small group High degree of initiative and a proven problem solver Fluent in English language both written and spoken personable and able to work at a detailed or high level We are an equal opportunity employer and value diversity at Our Core Beliefs lie at the heart of Arm and represent the essence of our organization and working together they articulate the uniqueness of Arm culture Passion for Progress Innovation that enables our ecosystem Arm and our people to thrive Work with pace and judgment Adapt to circumstance Take risk in support of Arm s progress Be for the decision you make Learn from failure Pursue innovation relentlessly We Not I Collaboration first ego last Start with long-term value to customer and partner and work back from there Collaborate and bring people with you Make the most of all the skill and across Arm share information with those who need it Care about the people around you Be your Brilliant Self Skillful individuality performance and fulfillment Be authentic Seek and embrace curiosity and challenge Give people trust and autonomy show people they can trust you to do brilliant work in pursuit of Arm s goal Arm ha a responsibility to ensure that all employee are eligible to live and work in the UK With office around the world Arm is a diverse organisation of innovative and highly talented professional By enabling a vibrant inclusive meritocratic and open workplace where all our people can grow and we our people to share their to Arm s success in the global marketplace LI-RB1 ,Tue Nov 24 14:12:33 2020,"title:(machine, learning)",,,,,59.0,Cambridge,2020-11-24
151,Linux Recruit,Data Scientist - Machine Learning (Python/SQL),One of the UK s fastest growing tech start-ups is building out their Data Science team This is an integral time a scale meaning you will be at the forefront of their technological development You will be involved in the full lifetime of their data product responsible for analysis of data to inform strategic business decision designing and building Machine Learning algorithm and creating experiment to test product offering and business direction moving forward Ideally you will live and breath Data Science The team are looking for passionate technologist who are keen to work with like-minded individual in a rapidly evolving environment Here are a few thing you ll probably need to be successful on this one Masters or PhD in Computer Science Statistics Applied Sciences or a similar field A genuine curiosity and passion for technology of year experience applying Machine Learning to live real-life problem and understanding of the Cloud Environments GCP AWS Azure Ability to program in Python and SQL Please apply directly or get in touch with Tom Booth at LinuxRecruit ,Tue Nov 24 14:12:39 2020,"title:(machine, learning)",,100000.0,52.69,Y,,London,2020-11-24
152,Apple,AI/ML - Machine Learning Internship,Summary Oct 26 2020 Role Number 200202062 As part of Apple s Machine Learning and AI team we transform every Apple product and because we fully integrate hardware and software we to deliver amazing experience while protecting the privacy of user and their data We are offering amazing internship opportunity to work directly with our R D team in Cambridge UK Collaborate with some of the best in the business and see how we create the world s most innovative product and experience Our internship are a minimum of three month and you must be available to start no later than 1st June 2021 Key Qualifications PhD student OR starting a PhD in 2021 science applied mathematics or related subject Expertise with Machine Learning or Natural Language Processing NLP ideally in one or more of these area Privacy-Preserving ML Natural Language Understanding NLU Natural Language Generation NLG Structured Unsupervised Learning Representation Learning Reasoning or Question Answering Programming skill in Python ML library like TensorFlow PyTorch etc Description Our aim is to create an experience that allows you to learn without pressure gain practical skill build real world experience develop a greater understanding of our industry and form You will join an extraordinary team including world-class software engineer and leading machine learning practitioner who are all passionate about applying groundbreaking technique to AI We will partner you with a dedicated mentor who is an authority in your specialist area You and your mentor to design and implement an innovative solution for an ML or NLP problem that is meaningful At the end of your internship you will have the chance to meet and present your work to the AI ML leadership Where appropriate there may be the opportunity to submit your work for publication at a Additional Requirements Apple s most important resource our soul is our people Apple benefit help further the well-being of our employee and their family in meaningful way No matter where you work at Apple you can take advantage of our health and wellness resource and time-away programme We re proud to provide stock grant to employee at all level of and we also give employee the option to buy Apple stock at a both offer everyone at Apple the chance to share in success You ll many more benefit of working at Apple such a programme that match your reimburse you and give you special employee pricing on Apple product Apple benefit programme vary and are subject to eligibility requirement Apple is an equal opportunity employer that to inclusion and diversity We take affirmative action to ensure equal opportunity for all applicant without regard to religion sex sexual orientation gender identity national origin disability Veteran status or other legally protected characteristic Apple to working with and providing reasonable to applicant with physical and mental disability Apple is a drug-free workplace ,Tue Nov 24 14:12:44 2020,"title:(machine, learning)",,,,,9910.0,Cambridge,2020-11-24
153,Apple,"AI/ML- Machine Learning Internship (NLP), Siri Knowledge",Summary Nov 17 2020 Weekly Hours 35 Role Number 200196339 The Siri Graph team is creating groundbreaking technology in the area of question answering and machine learning We aim at being a know-it-all capable of answering question from of million of user about nearly anything You will have exciting opportunity to develop novel technique to rapidly improve a question answering system that demonstrates such a graph The graph is used not only by Siri to answer question but by many other team within Apple a well Key Qualifications Research experience in natural language processing machine learning or artificial intelligence Good publication track and history of creativity and intellectual flexibility Excellent programming skill in Python or Go Good software design problem solving and debugging skill Self-motivation Description This position requires a highly motivated person who want to help u do fundamental academic research a well a invent real-world solution You will be responsible for implementing evaluating and improving machine learning algorithm based on the latest advancement in the field You will work tightly with our team and apply their and innovative approach to improve Siri capability of understanding natural language a rapidly growing graph Apple s most important resource our soul is our people Apple benefit help further the well-being of our employee and their family in meaningful way No matter where you work at Apple you can take advantage of our health and wellness resource and time-away programme We re proud to provide stock grant to employee at all level of and we also give employee the option to buy Apple stock at a both offer everyone at Apple the chance to share in success You ll many more benefit of working at Apple such a programme that match your reimburse you and give you special employee pricing on Apple product Apple benefit programme vary and are subject to eligibility requirement Apple is an equal opportunity employer that to inclusion and diversity We take affirmative action to ensure equal opportunity for all applicant without regard to religion sex sexual orientation gender identity national origin disability Veteran status or other legally protected characteristic Apple to working with and providing reasonable to applicant with physical and mental disability Apple is a drug-free workplace Education Experience Pursuing a PhD or Masters science machine learning electrical engineering or equivalent ,Tue Nov 24 14:12:50 2020,"title:(machine, learning)",,,,,9910.0,London,2020-11-24
