,company,job_title,job_descr,time_of_scrape,job_search_term,job_location,salary_from_page_source_as_stated,salary_from_page_source_conv_hourly,salary_from_page_source_time_period,Num_reviews,Loc_from_title,date
91,Linux Recruit,"C++ Developer - Risk, Machine Learning - London",You will be joining a machine learning tech start up focused on risk modelling that is looking to triple in size over the next 12 month As a Senior C Engineer you will be involved in the design and build of their risk platform meaning daily working on tech road map architecture R D and senior stakeholder discussion One of the appeal is that you are joining a group of very strong technologist You ll with very clever people that work hard to get thing done You ll learn discus and pas on in a no ego supportive environment From a tech point of view your focus will be C but you will also get the chance to work with Python JavaScript AWS k8s and like Monte Carlo You ll also be trusted to ensure is reliable scalable and fast As a senior technologist in you can also expect to do some mentoring and have a chance to build a team beneath you Your experience doing this in previous role would be beneficial but the team are equally interested in hearing from experienced engineer looking to take that step up If you ve read this far it s probably worth having with me to learn more Get in touch with Tom Booth at LinuxRecruit I m keen to speak to anyone in this space and happy to share more information ,Tue Nov 24 14:07:09 2020,"title:(machine, learning)",,90000.0,47.42,Y,,London,2020-11-24
92,G,Internship in Machine Learning,G-Research is Europe s leading quantitative finance research firm We hire the brightest mind in the world to tackle some of the biggest question in finance We pair this expertise with machine learning big data and some of the most advanced technology available to movement in financial market The role 10 week summer programme July to September 2021 09 00-17 30 working hour Based in Central London Joining G-Research s Summer Internship Programme you will be given a meaningful and challenging research project that demand the application of innovative yet pragmatic mathematical analysis Our full-time ML researcher have the opportunity to use a range of ML tool in an applied setting putting their ML expertise to use in direct production-ready application with result They have access to resource and are limited only by their imagination As an ML intern you will have the opportunity to experience some of this a part of a 10 week programme working on and interesting ML problem You will be paired with a mentor who will supervise your work and provide ongoing to help you improve and develop a well a access to senior staff who are leader in their field Your internship will culminate in a final presentation of your research idea to senior management and upon of the programme many intern are offered the opportunity to join u full-time once they their study Taking part in G-Research s Summer Internship Programme will give you an in-depth insight into our academic approach to the world of quantitative finance and allow you to explore the thriving city of London while you get to know your fellow intern through a full itinerary of fun social event Who are we looking for Either a post-graduate degree in machine learning or a related discipline experience developing novel machine learning algorithm We will exceptional candidate with a proven of success in online data e g Kaggle Experience in one or more of deep learning reinforcement learning optimisation Bayesian non-parametrics NLP or approximate inference Excellent reasoning skill and mathematical ability are crucial off the shelf method don t always work on our data so you will need to understand how to develop your own model Strong programming skill and experience working with Python Scikit-Learn SciPy NumPy Pandas and Jupyter Previous experience in finance is not although an interest in finance and the motivation to rapidly learn more is a prerequisite for working here Why should you apply compensation plus generous allowance with weekly intern activity Informal and excellent work life balance Central London office close to 5 station and 6 tube line ,Tue Nov 24 14:07:15 2020,"title:(machine, learning)",,,,,9.0,London,2020-11-24
93,Evolution AI,Experienced Machine Learning Engineer (Full Time),Evolution AI are looking for a machine learning engineer to help build our AI-powered document extraction platform You ll work on challenging research problem including designing and scaling our multi-modal deep learning model that language and visual information You ll be putting state of the art deep learning technology into production use with an emphasis on reproducibility and durability You ll be working alongside expert machine learning researcher and software engineer Must be eligible to work in the UK Option to work remotely or from our central London office About UsEvolution AI use artificial intelligence to extract data from document with human-like accuracy Our product are self-learning so there is no need to or define is having received one of the largest grant for AI R D from the UK government and working with academic partner from multiple university Evolution AI sits at the heart of the in London Sharing our expertise and inspiring the adoption of AI is integral to our value we lead the of AI practitioner in Europe London Machine Learning which ha almost 10 000 member Our CEO chair the membership organisation representing Data Scientists in the UK the Data Section of the Royal Statistical Society helping the field of data science grow into a mature industrial discipline is to our value http www evolution ai We are an equal opportunity employer and are signed up to the Tech Talent Charter developing and rigorously testing machine learning algorithm Writing and maintaining machine in our production platform Communicating research progress to the wider team with our academic partner Working with and product team to define requirement and shape the future of our product Technical RequirementsProficient at writing production-quality Python with a deep learning framework such a Tensorflow or PyTorch Experience with the typical Python data science stack e g Pandas Numpy Scikit-learn Proficiency with SQL Familiarity with Unix Nice to havePhD MSc in machine science mathematics or similar Interest in multi-modal deep learning e g Visual Question Answering Experience with large-scale language model such a BERT PerksGenerous option package Opportunity to of opportunity to get involved with the wider machine working available Team lunch and drink event Job Types Full-time PermanentSalary 40 000 00 60 000 00 per yearBenefits Casual dressCompany or free foodFlexible payWork from to are currently working remotely and future office working will be optional Experience Machine Learning 2 year remotely Yes always ,Tue Nov 24 14:07:20 2020,"title:(machine, learning)",,60000.0,31.61,Y,,London,2020-11-24
94,Echobox,Machine Learning Engineer - London,Echobox ha access to very large granular private data set and is currently only using a small part of this in end user product You will work closely with our CTO to help push the boundary of what the Echobox Artificial Intelligence is capable of achieving with this data Key Responsibilities You to the development of prototype that can be turned into end user product by development team You will assist in the customisation of the product for new customer and trial data analysis where You will stay up to date with the latest advance in ML and AI About Echobox We are a fast-growing building an artificial intelligence that help online publisher the challenge they face every day Using novel machine learning technique we are revolutionising the publishing industry and have a track of building thing that others have ruled out a impossible Leading name from around the world rely on our product every day including The Times Le Monde The Guardian Vogue and many more Our team is our best asset We work with extremely smart and talented individual who all enjoy a high degree of responsibility and independence in structuring their work To get a better insight into the kind of work we do check out our open-source project on Github our data showcase and our on Microservices Do you think you have what it take to be part of Echobox We d love to hear from you Requirements Minimum Academic Qualifications 2 1 degree in a STEM subject from a top tier university Required Skills and Experience Fluent written and spoken English A very strong understanding of classical statistic A basic of different ML and AI methodology and the desire to an expert Strong background in a programming language suitable for analysis e g R Python Java C C A familiarity with Java SE7 and a desire to an expert An ability and desire to learn new skill quickly Genuine passion for making the impossible possible Preferred Skills Strong or experience in one area of ML and AI Experience developing software a part of a team e g DVCS open source software project Working of big data architecture i e NoSQL Hadoop etc Benefits Our employee enjoy free breakfast every drink and snack all day everyday Every Wednesday we order food for our weekly team lunch where everyone get together for an hour of fun We have monthly team event dinner bowling karting poker night board-games etc for our team to get to know each other outside of work Professionally we host and an annual summer camp for all our global employee who are flown to and hosted in London We ensure that all our employee also get the latest tech generous annual leave and an amazing office with a overlooking Notting Hill ,Tue Nov 24 14:07:26 2020,"title:(machine, learning)",,,,,,London,2020-11-24
95,UBS,Software Engineer - Data / Machine Learning,Your role Do you enjoy solving a variety of challenge in the world of Big data and data science Do you get excited about seeing how your work directly impact the business We are looking for a software engineer who is passionate about developing data ML pipeline a well a application that deliver creative solution to our client and Sales Trading team to power our business strategy If yourself a strong developer in the financial industry but don t have a lot of data background you are still to apply Your team You will join the Global Markets Intelligence team a growing team of data scientist and engineer who are working within our Global Markets trading unit to build the data platform model and tool that deliver the next generation of analytics to empower both trader and salesperson alike This will entail specific quantitative data project across a range of product area Equities Rates FX under a remit to deliver increased revenue through enhanced decision making and data-driven client engagement at scale Your expertise 4-10 year of strong experience designing and developing large application analytics and data pipeline in a rigorous production environment proficiency in Java and or Python or similar Experience in both is a huge plus experience developing application that rely on many web APIs and other experience in some or all of data and cloud technology such a Spark Kafka Hadoop YARN Cloudera Airflow Oozie S3 Presto Kafka Connect Microsoft Azure Terraform Hive etc good of building event-driven distributed application enthusiasm and ability to pick up new technology a to solve your problem experience or interest in getting involved with data infrastructure like Cloudera Azure on-premise bachelor or Masters in Computer Science Applied Mathematics or a related technical field strong verbal and skill Nice to have of and experience in one or more product area across FX Rates Equities within the financial ecosystem is a huge plus experience with Pydata stack Pandas Numpy Matplotlib scikit-learn etc is a plus track of solving real-world problem using Data Science ML NLP etc and statistical technique and deploying ML model experience in setting up and using data science platform like Dataiku Databricks or Alteryx etc experienced application deployment e g with Docker using Kubernetes working of UNIX or similar and bash scripting LI-GB EFC-UBS About u Expert advice Wealth management Investment banking Asset management Retail banking in Switzerland And all the support function That s what we do And we do it for private and institutional client a well around the world We are about 60 000 employee in all major financial center in more than Do you want to be one of u Join u We re a truly and friendly group of people Having a diverse inclusive and respectful workplace is important to u And we support your career development internal mobility and work-life balance If this sound interesting apply now Disclaimer Policy Statements UBS is an Equal Opportunity Employer We respect and seek to empower each individual and support the diverse culture perspective skill and experience within our workforce Apply now Save ,Tue Nov 24 14:07:32 2020,"title:(machine, learning)",,,,,2108.0,London,2020-11-24
96,Tesco,Data Scientist - Machine Learning,About the role At our Data Science team focus on business problem and deploying data product at scale Our work span across multiple area including physical store online supply chain marketing and Clubcard where we rotation amongst our Data Scientists so they can gain expertise in different subject We work on several domain and problem type online pricing security fulfilment distribution property IoT vision are just some Our team member spend 10 of their week on learning and personal development Multiple enrich the team expertise sharing event are regular Furthermore we have got a great work-life balance team day and relaxed but engaging culture You will be responsible for This is a hands-on position where you will need to leverage your analytical mindset to find solution problem As a Data Scientist you will need to understand difficult business problem and prototype solution with minimal support Apply modify and design algorithm and mathematical model to solve business problem on top of big data architecture Hadoop Spark is component of the role Our data scientist will need to be able to validate document and present the modeling process and performance a well complex solution in a clear understandable way to non-experts Data Scientists are also responsible for promoting data science across Tesco and promote Tesco across the external Data You will need We are looking for ambitious individual with a mix of statistic programming and machine learning skill The role requires that you have an extensive background in machine learning and data mining A track in modifying and designing advanced algorithm and applying them to large data set is essential An ideal candidate will have a scientific mentality with the ability to ask the right question a well a answer them A strong numerical higher degree in a mathematical scientific engineering science discipline is preferable a well a a solid understanding of mathematics and statistical principle Experience in one or more of the following field is modelling operational research deep learning and time series modelling Finally strong programming experience Python is About u Our vision here at Tesco is to every customer s favourite way to shop whether they are at home out shopping on the move anywhere in the world In order to enable our vision we strive to simplify operation for our Colleagues Partners Vendors to enable efficient trade Everything is underpinned by drive for the best tool and technology to deliver our vision We re driving innovation and transforming our Technology to the world s leading retailer We need people who share our ambition to deliver for our stakeholder Passionate people willing to take the initiative and drive u forward In return we offer excitement a great team an excellent benefit package and significant career development opportunity Joining u mean playing a part in defining building and launching an ambitious roadmap of digital product affect the life of million of people over the year If that sound exciting then we d love to hear from you The position will be based in London with occasional travel to our Welwyn office ,Tue Nov 24 14:07:37 2020,"title:(machine, learning)",,,,,16588.0,Welwyn Garden City,2020-11-24
97,Behold.ai,Intern - Machine Learning Engineer,Location London We have open position for seasonal intern looking to start their career in the role of a Data Scientist and Machine Learning Engineer The internship programme will gain valuable experience of working for an innovative and growing AI If you would like to apply for an internship please send u your resume CV by clicking on the button below ,Tue Nov 24 14:07:42 2020,"title:(machine, learning)",,,,,,London,2020-11-24
98,Secondmind,Senior Machine Learning Engineer,About the role This is an exciting opportunity to join a team at the forefront of artificial intelligence and applied machine learning At we re developing technology that can be used across many different domain to enable people to make better decision You will be working in interdisciplinary team delivering customer value through the development and refinement of ML tool and the application of these tool to customer problem You will be developing our machine learning technology and guiding their application within customer engagement to new solution in transportation and logistics the automotive industry and beyond This mean lot of variety and involves working within client project and internal product development Your work will be directly used and built upon in our product What will you be responsible for Leading multidisciplinary team to solve novel customer problem through applying and extending our state-of-the-art machine learning technique Working with researcher and platform engineer to migrate research prototype to production Continuously developing your own machine learning and engineering skill and helping others to improve theirs Contributing to culture review and design discussion In your role a a Senior Machine Learning Engineer the defining measure of your success is being able to successfully solve novel real-world problem through using our ML technology in a manner that is robust and creative a well a having the potential to be scalable What skill experience and qualification do you need to succeed in this role As an expert in system you will be responsible for identifying how to best design develop and deploy our ML technology to allow our customer to make better decision You will enjoy solving novel technical problem and be able to share this enthusiasm with your team You will be someone who ha industry experience working in software engineering data science or machine learning and strong appreciation of all three area This will include deep of at least one programming language e g Python or C You will have an ability to across different technical area You will have previously worked on customer project and with project stakeholder You will have the trust and autonomy to plan your work independently taking into the requirement of your team and the project work Where you see space for improvement we ll you to highlight these and make them happen You will ideally hold a Bachelors and potentially a Masters science software engineering statistic machine learning or other numerate field Other degree will with relevant work experience You will be someone who actively improves your technical either through identifying or pursuing self-study a We sharing throughout the team through internal seminar lightning talk and participating in training activity About We are born in 2016 with a mission to empower people to make better decision We are a cross-disciplinary team of researcher engineer and product manager based in Cambridge UK a global centre of AI excellence branch of mathematics and engineering in way that have never been done before our integrated approach and our industry-leading research give u a advantage We take pride in our diversity valuing the experience and expertise that people from different background bring to our organisation Our team of approximately 100 talented people from all over the of over 20 different nationality We innovative ambitious optimistic and curious We are on a mission to empower people to make better decision Because people powered by AI make better decision Salary Competitive salary depending on experience Stock option benefit Click here to view our Candidate Privacy Notice ,Tue Nov 24 14:07:48 2020,"title:(machine, learning)",,,,,,Cambridge,2020-11-24
99,Okra Technologies,Machine Learning Data Scientist,Do you want the future of healthcare driving better result for patient and business Do you love creative autonomy a tight team and a dynamic environment Are you transparent a straight talker and respectfully direct If so be the OKRAN we are looking for Your journey You will be working alongside the best You will play a critical role in designing and building machine learning solution using the leading AI engine for healthcare and life science You will work closely with our executive team who have worked for over 12 year implementing machine learning for real-world application turning research reality You will have a large impact on the design architecture and refinement of the machine learning approach in healthcare You will also have a key role in driving the development of tool to expose the mined information taking advantage of the latest technology available You will Define and build system to model unstructured data set to generate insight for clinical problem that ML can solve Applying NLP technique and statistical analysis to extract and validate data generated Setting up and maintaining Data Science pipeline Contribute to defining and testing our product in the broadest sense possible including testing for AI bias transparency and reliability Work closely with both our engineering and data science team to drive product release Join a highly skilled international team with diverse background and a gender equality policy based both in Cambridge UK and Leiden NL Your profile We are looking for a highly motivated data scientist with a strong background in building Machine Learning ML and Deep Learning DL model to develop statistical solution based on OKRA s ground breaking technology You have a strong track a an experienced ML data scientist to problem using AI Proficiency with Python programming and ML framework Familiarity with Agile framework SQL JIRA NLP library and AWS is a plus You have great attention to detail an analytical mind and problem-solving aptitude You determined in delivering ML solution in a fast-paced environment assuming it is always going to be tough You are passionate about solving real-world healthcare and life science problem with machine learning and statistical modelling You are transparent a straight talker and respectfully blunt You are able to right a wrong decision give to others and extend trust to Clear oral and Who we are We are using artificial intelligence to transform healthcare a we know it We are on a mission to create the world s most AI analytics engine Read more about u here Our value We aim to build a trusting fun and creative environment We place our faith in smart independent teammate working together to achieve maximum impact Find out more about our culture on our main career page Benefits Creative autonomy join a small team with a high level of responsibility Young vibrant and with impressive experience Opportunity for occasional home working 25 day annual leave Mentoring in AI testing and productisation Any question Email u at ,Tue Nov 24 14:07:53 2020,"title:(machine, learning)",,,,,,Cambridge,2020-11-24
100,Linux Recruit,"Software Engineer (Python/C++), AI/Machine Learning - Bristol",Artificial Intelligence or simply AI is one of the biggest tech buzz word of the year It seems to pop up in almost every other job advert in some way or another often being used in some distant team you ll never talk to Well how would you like to join a rapidly scaling where you ll immersed in it The entire product is 100 AI driven so there isn t really any getting away from it The good thing is that you won t need in AI just strong of Python and or C This position is for a software engineer who want to build state of the art AI technology solution using the latest tool This team in particular will see you building out the very platform is known for At the hub of everything going on you ll have full visibility over every project and be in a prime position to up skill and learn As such whilst your focus will be development you ll also have exposure to infrastructure DevOps tool like Kubernetes Docker Terraform and AWS The type of person that would suit this role will have strong of Python or C mathematics ideally a Comp Sci or and an interest in AI You ll be based in central Bristol in modern office with the latest toy Choose what you want to wear and pick your own hour within reason For more detail on this get in touch with myself Tom Booth at LinuxRecruit Or simply apply to this advert ,Tue Nov 24 14:07:59 2020,"title:(machine, learning)",,75000.0,39.52,Y,,Bristol,2020-11-24
